{
 "id": "table.trucos-conjuros-de-bardo-de-nivel-0",
 "caption": "Trucos (conjuros de bardo de nivel 0)",
 "header": [
  "Conjuro",
  "Escuela",
  "Especial"
 ],
 "rows": [
  [
   "Burla dañina",
   "Encantamiento",
   "—"
  ],
  [
   "Ilusión menor",
   "Ilusionismo",
   "—"
  ],
  [
   "Impacto certero",
   "Adivinación",
   "—"
  ],
  [
   "Luces danzantes",
   "Ilusionismo",
   "C"
  ],
  [
   "Luz",
   "Evocación",
   "—"
  ],
  [
   "Mano de mago",
   "Conjuración",
   "—"
  ],
  [
   "Mensaje",
   "Transmutación",
   "—"
  ],
  [
   "Prestidigitación",
   "Transmutación",
   "—"
  ],
  [
   "Reparar",
   "Transmutación",
   "—"
  ],
  [
   "Voluta estelar",
   "Evocación",
   "—"
  ]
 ],
 "fullWidth": false,
 "context": [
  "Clases",
  "Bardo",
  "Lista de conjuros de bardo"
 ],
 "source": {
  "book": "SRD 5.2.1 es",
  "page": 37
 }
}