{
 "id": "table.costes-de-pergaminos-de-conjuro",
 "caption": "Costes de pergaminos de conjuro",
 "header": [
  "Nivel del conjuro",
  "Tiempo",
  "Coste"
 ],
 "rows": [
  [
   "Truco",
   "1 día",
   "15 po"
  ],
  [
   "1",
   "1 día",
   "25 po"
  ],
  [
   "2",
   "3 días",
   "100 po"
  ],
  [
   "3",
   "5 días",
   "150 po"
  ],
  [
   "4",
   "10 días",
   "1000 po"
  ],
  [
   "5",
   "25 días",
   "1500 po"
  ],
  [
   "6",
   "40 días",
   "10 000 po"
  ],
  [
   "7",
   "50 días",
   "12 500 po"
  ],
  [
   "8",
   "60 días",
   "15 000 po"
  ],
  [
   "9",
   "120 días",
   "50 000 po"
  ]
 ],
 "fullWidth": false,
 "context": [
  "Equipo",
  "Elaborar pergaminos de conjuro",
  "Trucos"
 ],
 "source": {
  "book": "SRD 5.2.1 es",
  "page": 113
 }
}