{
 "id": "table.comunicacion-del-objeto-consciente",
 "caption": "Comunicación del objeto consciente",
 "header": [
  "1d10",
  "Comunicación"
 ],
 "rows": [
  [
   "1–6",
   "El objeto se comunica transmitiendo emociones a la criatura que lo lleva o empuña."
  ],
  [
   "7–9",
   "El objeto habla uno o más idiomas."
  ],
  [
   "10",
   "El objeto habla uno o más idiomas. Además, puede comunicarse telepáticamente con cualquier criatura que lo lleve o empuñe."
  ]
 ],
 "fullWidth": false,
 "context": [
  "Objetos mágicos",
  "Objetos mágicos conscientes",
  "Atributos de objetos mágicos conscientes",
  "Propósito especial"
 ],
 "source": {
  "book": "SRD 5.2.1 es",
  "page": 227
 }
}