{
 "id": "table.p239",
 "caption": null,
 "header": [
  "Conjuro",
  "Coste en cargas"
 ],
 "rows": [
  [
   "Curar heridas",
   "1 carga por nivel del conjuro (máximo 4 para un conjuro de nivel 4)"
  ],
  [
   "Curar heridas en masa",
   "5"
  ],
  [
   "Restablecimiento menor",
   "2"
  ],
  [
   "Insecto gigante",
   "4"
  ],
  [
   "Plaga de insectos",
   "5"
  ]
 ],
 "fullWidth": false,
 "context": [
  "Objetos mágicos",
  "Objetos mágicos de la A a la Z",
  "Bastón de curación"
 ],
 "source": {
  "book": "SRD 5.2.1 es",
  "page": 239
 }
}