{
 "id": "table.rasgos-de-hechicero",
 "caption": "Rasgos de hechicero",
 "header": [
  "Nivel",
  "Bonificador por competencia",
  "Rasgos de clase",
  "Puntos de hechicería",
  "Trucos",
  "Conjuros preparados",
  "—Espacios de conjuro por cada nivel de conjuro— 123456789"
 ],
 "rows": [
  [
   "1",
   "+2",
   "Lanzamiento de conjuros, Hechicería innata",
   "—",
   "4",
   "2",
   "2————————"
  ],
  [
   "2",
   "+2",
   "Fuente de magia, Metamagia",
   "2",
   "4",
   "4",
   "3————————"
  ],
  [
   "3",
   "+2",
   "Subclase de hechicero",
   "3",
   "4",
   "6",
   "42———————"
  ],
  [
   "4",
   "+2",
   "Mejora de característica",
   "4",
   "5",
   "7",
   "43———————"
  ],
  [
   "5",
   "+3",
   "Recuperación mágica",
   "5",
   "5",
   "9",
   "432——————"
  ],
  [
   "6",
   "+3",
   "Rasgo de subclase",
   "6",
   "5",
   "10",
   "433——————"
  ],
  [
   "7",
   "+3",
   "Encarnación mágica",
   "7",
   "5",
   "11",
   "4331—————"
  ],
  [
   "8",
   "+3",
   "Mejora de característica",
   "8",
   "5",
   "12",
   "4332—————"
  ],
  [
   "9",
   "+4",
   "—",
   "9",
   "5",
   "14",
   "43331————"
  ],
  [
   "10",
   "+4",
   "Metamagia",
   "10",
   "6",
   "15",
   "43332————"
  ],
  [
   "11",
   "+4",
   "—",
   "11",
   "6",
   "16",
   "433321———"
  ],
  [
   "12",
   "+4",
   "Mejora de característica",
   "12",
   "6",
   "16",
   "433321———"
  ],
  [
   "13",
   "+5",
   "—",
   "13",
   "6",
   "17",
   "4333211——"
  ],
  [
   "14",
   "+5",
   "Rasgo de subclase",
   "14",
   "6",
   "17",
   "4333211——"
  ],
  [
   "15",
   "+5",
   "—",
   "15",
   "6",
   "18",
   "43332111—"
  ],
  [
   "16",
   "+5",
   "Mejora de característica",
   "16",
   "6",
   "18",
   "43332111—"
  ],
  [
   "17",
   "+6",
   "Metamagia",
   "17",
   "6",
   "19",
   "433321111"
  ],
  [
   "18",
   "+6",
   "Rasgo de subclase",
   "18",
   "6",
   "20",
   "433331111"
  ],
  [
   "19",
   "+6",
   "Don épico",
   "19",
   "6",
   "21",
   "433332111"
  ],
  [
   "20",
   "+6",
   "Apoteosis arcana",
   "20",
   "6",
   "22",
   "433332211"
  ]
 ],
 "fullWidth": true,
 "context": [
  "Clases",
  "Hechicero",
  "Rasgos de clase de hechicero",
  "Nivel 1: Lanzamiento de conjuros"
 ],
 "source": {
  "book": "SRD 5.2.1 es",
  "page": 65
 }
}