{
 "id": "table.p281",
 "caption": null,
 "header": [
  "VD",
  "PX",
  "VD",
  "PX"
 ],
 "rows": [
  [
   "9",
   "5000",
   "26",
   "90 000"
  ],
  [
   "10",
   "5900",
   "27",
   "105 000"
  ],
  [
   "11",
   "7200",
   "28",
   "120 000"
  ],
  [
   "12",
   "8400",
   "29",
   "135 000"
  ],
  [
   "13",
   "10 000",
   "30",
   "155 000"
  ]
 ],
 "fullWidth": false,
 "context": [
  "Monstruos",
  "Partes de un perfil",
  "Valor de desafío",
  "Puntos de experiencia"
 ],
 "source": {
  "book": "SRD 5.2.1 es",
  "page": 281
 }
}